{
  "schema_version": "1.0.0",
  "scene": "station_text_dialogue",
  "runtime_access": {
    "visibility": "entitled",
    "entitlement": "trial_week"
  },
  "npc": {
    "id": "npc.mateo.alvarez",
    "name": "Mateo Álvarez",
    "role": { "es": "empleado de estación", "nl": "stationsmedewerker" },
    "description": "Rustig, praktisch en vriendelijk. Mateo helpt de reiziger een fictieve treinreis te regelen zonder de rol van docent over te nemen."
  },
  "mission": {
    "id": "mission.madrid.station.ticket",
    "title": { "es": "Mi primer billete", "nl": "Mijn eerste treinkaartje" },
    "objective": "Vraag een fictief kaartje naar Toledo, kies heen of retour, los een wijziging op, vraag naar prijs en betaalwijze en controleer tijd en perron.",
    "start_step": "turn.request_ticket",
    "required_text_turns": 5
  },
  "journey": {
    "fictional": true,
    "title": { "es": "Tu viaje de práctica", "nl": "Jouw oefenreis" },
    "notice": "Dit is een fictieve taalopdracht en geen actuele dienstregeling of boeking.",
    "details": [
      { "label": { "es": "Destino", "nl": "Bestemming" }, "value": { "es": "Toledo", "nl": "Toledo" } },
      { "label": { "es": "Ida", "nl": "Heenreis" }, "value": { "es": "mañana por la mañana", "nl": "morgen in de ochtend" } },
      { "label": { "es": "Vuelta", "nl": "Terugreis" }, "value": { "es": "el domingo", "nl": "zondag" } }
    ]
  },
  "level_branches": {
    "A0": "branch.choose_time",
    "A1": "branch.accept_later_train",
    "A2": "branch.compare_connections"
  },
  "repair": {
    "terms": ["puede repetir", "repita por favor", "mas despacio", "no entiendo", "que significa", "quiero decir"],
    "npc_response": {
      "es": "Claro. Se lo explico de otra manera y más despacio.",
      "nl": "Natuurlijk. Ik leg het anders en wat langzamer uit."
    },
    "feedback": {
      "strength": "Sterk: je vraagt zelf om de informatie die je nodig hebt.",
      "focus": "Om herhaling vragen houdt een echt reisgesprek veilig op gang."
    }
  },
  "steps": [
    {
      "id": "turn.request_ticket",
      "turn": 1,
      "npc_line": { "es": "Buenos días. ¿En qué puedo ayudarle?", "nl": "Goedemorgen. Waarmee kan ik u helpen?" },
      "prompt": "Begroet Mateo en vraag om een kaartje naar Toledo voor morgenochtend.",
      "placeholder": "Buenos días. Quisiera un billete a Toledo para mañana por la mañana.",
      "hint": "Quisiera un billete a… is een beleefde manier om een kaartje te vragen.",
      "choices": ["Buenos días. Quisiera un billete a Toledo para mañana por la mañana.", "Hola. Un billete para Toledo mañana por la mañana, por favor."],
      "options": [
        {
          "id": "ticket_to_toledo",
          "requirements": [["billete", "ticket"], ["toledo"], ["mañana", "manana"]],
          "npc_response": { "es": "Perfecto. ¿Quiere solo ida o ida y vuelta?", "nl": "Prima. Wilt u alleen heen of een retour?" },
          "feedback": { "strength": "Bestemming en reisdag waren meteen duidelijk.", "focus": "Quisiera klinkt vriendelijk en natuurlijk aan een loket." },
          "states": ["destination_confirmed", "travel_day_confirmed"],
          "next": "turn.choose_return"
        }
      ],
      "fallback": { "strength": "Je hebt Mateo aangesproken.", "focus": "Noem billete, Toledo en mañana om je reisvraag compleet te maken." }
    },
    {
      "id": "turn.choose_return",
      "turn": 2,
      "npc_line": { "es": "¿Quiere solo ida o ida y vuelta?", "nl": "Wilt u alleen heen of een retour?" },
      "prompt": "Kies een retour en zeg dat je zondag wilt terugkomen.",
      "placeholder": "Ida y vuelta, por favor. Quiero volver el domingo.",
      "hint": "Ida y vuelta betekent heen en terug; volver is terugkomen.",
      "choices": ["Ida y vuelta, por favor. Quiero volver el domingo.", "Un billete de ida y vuelta. Regreso el domingo."],
      "options": [
        {
          "id": "return_sunday",
          "requirements": [["ida y vuelta", "regreso", "volver"], ["domingo"]],
          "npc_response": { "es": "Muy bien. Veamos los trenes de la mañana.", "nl": "Prima. We bekijken de treinen in de ochtend." },
          "feedback": { "strength": "Je maakte zowel het kaarttype als de terugreis duidelijk.", "focus": "Ida y vuelta is de vaste combinatie voor een retour." },
          "states": ["return_ticket_requested", "return_day_confirmed"],
          "next": "@complication"
        }
      ],
      "fallback": { "strength": "Je reageert op de keuze tussen enkel en retour.", "focus": "Gebruik ida y vuelta en noem domingo als terugreisdag." }
    },
    {
      "id": "branch.choose_time",
      "turn": 3,
      "npc_line": { "es": "Hay un tren a las nueve y otro a las once. ¿Cuál prefiere?", "nl": "Er is een trein om negen uur en een om elf uur. Welke heeft uw voorkeur?" },
      "prompt": "Kies de trein van negen uur.",
      "placeholder": "El tren de las nueve, por favor.",
      "hint": "El tren de las nueve betekent de trein van negen uur.",
      "choices": ["El tren de las nueve, por favor.", "Prefiero el de las nueve."],
      "options": [
        {
          "id": "choose_nine",
          "requirements": [["nueve", "9"]],
          "npc_response": { "es": "De acuerdo. El de las nueve.", "nl": "In orde. Die van negen uur." },
          "feedback": { "strength": "Je koos kort en ondubbelzinnig een vertrektijd.", "focus": "El de las nueve voorkomt dat je het hele zinsdeel hoeft te herhalen." },
          "states": ["complication_resolved", "departure_option_selected"],
          "next": "turn.ask_price"
        }
      ],
      "fallback": { "strength": "Je begrijpt dat Mateo twee tijden aanbiedt.", "focus": "Kies nueve of once om de vertrektijd vast te leggen." }
    },
    {
      "id": "branch.accept_later_train",
      "turn": 3,
      "npc_line": { "es": "El tren de las diez está completo. Hay otro a las diez y cuarenta. ¿Le parece bien?", "nl": "De trein van tien uur is vol. Er is een andere om tien voor elf. Is dat goed?" },
      "prompt": "Accepteer de latere trein en bevestig de nieuwe tijd.",
      "placeholder": "Sí, el de las diez y cuarenta me parece bien.",
      "hint": "Me parece bien betekent dat is prima voor mij.",
      "choices": ["Sí, el de las diez y cuarenta me parece bien.", "De acuerdo. Tomo el tren de las diez y cuarenta."],
      "options": [
        {
          "id": "accept_ten_forty",
          "requirements": [["diez y cuarenta", "10:40", "me parece bien", "de acuerdo"]],
          "npc_response": { "es": "Perfecto. Reservo el de las diez y cuarenta.", "nl": "Prima. Ik reserveer die van tien voor elf." },
          "feedback": { "strength": "Je reageerde zelfstandig toen de eerste trein vol bleek.", "focus": "Me parece bien is een natuurlijke manier om een alternatief te accepteren." },
          "states": ["complication_resolved", "alternative_option_accepted"],
          "next": "turn.ask_price"
        }
      ],
      "fallback": { "strength": "Je begrijpt dat de eerste trein niet beschikbaar is.", "focus": "Bevestig diez y cuarenta of accepteer met me parece bien." }
    },
    {
      "id": "branch.compare_connections",
      "turn": 3,
      "npc_line": { "es": "Puede salir a las nueve con un cambio o a las once en un tren directo. ¿Qué prefiere?", "nl": "U kunt om negen uur vertrekken met een overstap of om elf uur met een rechtstreekse trein. Wat heeft uw voorkeur?" },
      "prompt": "Kies de rechtstreekse trein en leg uit dat je liever niet overstapt.",
      "placeholder": "Prefiero el tren directo de las once porque no quiero hacer transbordo.",
      "hint": "Tren directo is een rechtstreekse trein; hacer transbordo is overstappen.",
      "choices": ["Prefiero el tren directo de las once porque no quiero hacer transbordo.", "El de las once, por favor. Prefiero viajar sin transbordo."],
      "options": [
        {
          "id": "choose_direct_train",
          "requirements": [["directo", "sin transbordo", "no quiero hacer transbordo"], ["once", "11"]],
          "npc_response": { "es": "Entendido. Le reservo el tren directo de las once.", "nl": "Begrepen. Ik reserveer de rechtstreekse trein van elf uur." },
          "feedback": { "strength": "Je vergeleek twee verbindingen en motiveerde je keuze.", "focus": "Prefiero… porque… maakt je voorkeur in één natuurlijke zin duidelijk." },
          "states": ["complication_resolved", "connection_option_selected"],
          "next": "turn.ask_price"
        }
      ],
      "fallback": { "strength": "Je hoort het verschil tussen vroeg met overstap en later rechtstreeks.", "focus": "Noem directo of transbordo én een tijd om je keuze duidelijk te maken." }
    },
    {
      "id": "turn.ask_price",
      "turn": 4,
      "npc_line": { "es": "Ya tengo la conexión. ¿Necesita algo más?", "nl": "Ik heb de verbinding gevonden. Heeft u nog iets nodig?" },
      "prompt": "Vraag hoeveel het retour kost en zeg dat je met de kaart wilt betalen.",
      "placeholder": "¿Cuánto cuesta el billete de ida y vuelta? Quiero pagar con tarjeta.",
      "hint": "¿Cuánto cuesta? vraagt naar de prijs; pagar con tarjeta is met de kaart betalen.",
      "choices": ["¿Cuánto cuesta el billete de ida y vuelta? Quiero pagar con tarjeta.", "¿Cuál es el precio? Pago con tarjeta, por favor."],
      "options": [
        {
          "id": "ask_price_pay_card",
          "requirements": [["cuanto cuesta", "precio"], ["tarjeta"]],
          "npc_response": { "es": "Son veinticuatro euros. Puede pagar con tarjeta.", "nl": "Het is vierentwintig euro. U kunt met de kaart betalen." },
          "feedback": { "strength": "Je vroeg prijs en betaalwijze in één heldere beurt.", "focus": "¿Cuánto cuesta? is de meest directe en breed bruikbare prijsvraag." },
          "states": ["price_requested", "payment_method_confirmed"],
          "next": "turn.confirm_details"
        }
      ],